{
  "schema_version": "2.0",
  "record_kind": "material_admission_policy",
  "stable_ref": "sg:policy/material-admission-v2",
  "media_type": "text/markdown",
  "allowed_materials": [
    {
      "repository_path": "AGENTS.md",
      "domain": "shared",
      "lifecycle": "stable"
    },
    {
      "repository_path": "CATALOG.md",
      "domain": "layout",
      "lifecycle": "generated"
    },
    {
      "repository_path": "DOMAINS.md",
      "domain": "shared",
      "lifecycle": "stable"
    },
    {
      "repository_path": "GOVERNANCE.md",
      "domain": "shared",
      "lifecycle": "stable"
    },
    {
      "repository_path": "GUIDE.md",
      "domain": "layout",
      "lifecycle": "stable"
    },
    {
      "repository_path": "README.md",
      "domain": "shared",
      "lifecycle": "stable"
    },
    {
      "repository_path": "consumer-reference/agent-native/README.md",
      "domain": "shared",
      "lifecycle": "experimental"
    },
    {
      "repository_path": "consumer-reference/contract.md",
      "domain": "shared",
      "lifecycle": "stable"
    },
    {
      "repository_path": "consumer-reference/index.md",
      "domain": "shared",
      "lifecycle": "stable"
    },
    {
      "repository_path": "design-engineering/component-contract.md",
      "domain": "design-engineering",
      "lifecycle": "experimental"
    },
    {
      "repository_path": "design-engineering/consumer-migration-readiness.md",
      "domain": "design-engineering",
      "lifecycle": "experimental"
    },
    {
      "repository_path": "design-engineering/decision-tree.md",
      "domain": "design-engineering",
      "lifecycle": "experimental"
    },
    {
      "repository_path": "design-engineering/index.md",
      "domain": "design-engineering",
      "lifecycle": "experimental"
    },
    {
      "repository_path": "design-engineering/interface-craft.md",
      "domain": "design-engineering",
      "lifecycle": "experimental"
    },
    {
      "repository_path": "design-engineering/loading-and-feedback.md",
      "domain": "design-engineering",
      "lifecycle": "experimental"
    },
    {
      "repository_path": "design-engineering/native-interaction-contracts.md",
      "domain": "design-engineering",
      "lifecycle": "experimental"
    },
    {
      "repository_path": "design-engineering/state-management/decision-tree.md",
      "domain": "design-engineering",
      "lifecycle": "experimental"
    },
    {
      "repository_path": "design-engineering/state-management/index.md",
      "domain": "design-engineering",
      "lifecycle": "experimental"
    },
    {
      "repository_path": "design-engineering/state-management/patterns/derived-state.md",
      "domain": "design-engineering",
      "lifecycle": "experimental"
    },
    {
      "repository_path": "design-engineering/state-management/patterns/draft-and-baseline.md",
      "domain": "design-engineering",
      "lifecycle": "experimental"
    },
    {
      "repository_path": "design-engineering/state-management/patterns/id-selection.md",
      "domain": "design-engineering",
      "lifecycle": "experimental"
    },
    {
      "repository_path": "design-engineering/state-management/patterns/identity-reset.md",
      "domain": "design-engineering",
      "lifecycle": "experimental"
    },
    {
      "repository_path": "design-engineering/state-management/patterns/latest-request-wins.md",
      "domain": "design-engineering",
      "lifecycle": "experimental"
    },
    {
      "repository_path": "design-engineering/state-management/patterns/optimistic-overlay.md",
      "domain": "design-engineering",
      "lifecycle": "experimental"
    },
    {
      "repository_path": "design-engineering/state-management/patterns/single-flight.md",
      "domain": "design-engineering",
      "lifecycle": "experimental"
    },
    {
      "repository_path": "design-engineering/state-management/patterns/single-owner.md",
      "domain": "design-engineering",
      "lifecycle": "experimental"
    },
    {
      "repository_path": "design-engineering/state-management/patterns/submitted-snapshot.md",
      "domain": "design-engineering",
      "lifecycle": "experimental"
    },
    {
      "repository_path": "design-engineering/state-management/patterns/unsaved-navigation.md",
      "domain": "design-engineering",
      "lifecycle": "experimental"
    },
    {
      "repository_path": "design-engineering/state-management/patterns/url-state.md",
      "domain": "design-engineering",
      "lifecycle": "experimental"
    },
    {
      "repository_path": "design-engineering/state-management/patterns/versioned-restore.md",
      "domain": "design-engineering",
      "lifecycle": "experimental"
    },
    {
      "repository_path": "design-engineering/state-management/recipes/delete-undo.md",
      "domain": "design-engineering",
      "lifecycle": "experimental"
    },
    {
      "repository_path": "design-engineering/state-management/recipes/index.md",
      "domain": "design-engineering",
      "lifecycle": "experimental"
    },
    {
      "repository_path": "design-engineering/state-management/recipes/multi-step-form.md",
      "domain": "design-engineering",
      "lifecycle": "experimental"
    },
    {
      "repository_path": "design-engineering/state-management/recipes/search-detail.md",
      "domain": "design-engineering",
      "lifecycle": "experimental"
    },
    {
      "repository_path": "design-engineering/state-management/recipes/settings-save.md",
      "domain": "design-engineering",
      "lifecycle": "experimental"
    },
    {
      "repository_path": "design-engineering/state-management/state-brief.md",
      "domain": "design-engineering",
      "lifecycle": "experimental"
    },
    {
      "repository_path": "design-engineering/state-management/verification.md",
      "domain": "design-engineering",
      "lifecycle": "experimental"
    },
    {
      "repository_path": "design-engineering/text-input-and-internationalization.md",
      "domain": "design-engineering",
      "lifecycle": "experimental"
    },
    {
      "repository_path": "design-engineering/worked-examples.md",
      "domain": "design-engineering",
      "lifecycle": "experimental"
    },
    {
      "repository_path": "design-terminology/comparison-workflow.md",
      "domain": "design-terminology",
      "lifecycle": "experimental"
    },
    {
      "repository_path": "design-terminology/concept-families.md",
      "domain": "design-terminology",
      "lifecycle": "experimental"
    },
    {
      "repository_path": "design-terminology/conflict-cases.md",
      "domain": "design-terminology",
      "lifecycle": "experimental"
    },
    {
      "repository_path": "design-terminology/index.md",
      "domain": "design-terminology",
      "lifecycle": "experimental"
    },
    {
      "repository_path": "design-terminology/interaction-semantics.md",
      "domain": "design-terminology",
      "lifecycle": "experimental"
    },
    {
      "repository_path": "design-terminology/relation-types.md",
      "domain": "design-terminology",
      "lifecycle": "experimental"
    },
    {
      "repository_path": "design-terminology/source-kinds.md",
      "domain": "design-terminology",
      "lifecycle": "experimental"
    },
    {
      "repository_path": "design-terminology/source-vocabularies.md",
      "domain": "design-terminology",
      "lifecycle": "experimental"
    },
    {
      "repository_path": "design-terminology/token-semantics.md",
      "domain": "design-terminology",
      "lifecycle": "experimental"
    },
    {
      "repository_path": "design-terminology/typography-semantics.md",
      "domain": "design-terminology",
      "lifecycle": "experimental"
    },
    {
      "repository_path": "expression/brand-studies.md",
      "domain": "expression",
      "lifecycle": "experimental"
    },
    {
      "repository_path": "expression/direction-brief.md",
      "domain": "expression",
      "lifecycle": "experimental"
    },
    {
      "repository_path": "expression/directions/nocturne-editorial.md",
      "domain": "expression",
      "lifecycle": "experimental"
    },
    {
      "repository_path": "expression/directions/warm-print.md",
      "domain": "expression",
      "lifecycle": "experimental"
    },
    {
      "repository_path": "expression/index.md",
      "domain": "expression",
      "lifecycle": "experimental"
    },
    {
      "repository_path": "expression/techniques/gradient-atmosphere.md",
      "domain": "expression",
      "lifecycle": "experimental"
    },
    {
      "repository_path": "expression/techniques/grain-and-texture.md",
      "domain": "expression",
      "lifecycle": "experimental"
    },
    {
      "repository_path": "expression/techniques/webgl-hero.md",
      "domain": "expression",
      "lifecycle": "experimental"
    },
    {
      "repository_path": "game-ui/classification.md",
      "domain": "game-ui",
      "lifecycle": "experimental"
    },
    {
      "repository_path": "game-ui/decision-tree.md",
      "domain": "game-ui",
      "lifecycle": "experimental"
    },
    {
      "repository_path": "game-ui/index.md",
      "domain": "game-ui",
      "lifecycle": "experimental"
    },
    {
      "repository_path": "game-ui/reference-record.md",
      "domain": "game-ui",
      "lifecycle": "experimental"
    },
    {
      "repository_path": "game-ui/screen-hierarchy.md",
      "domain": "game-ui",
      "lifecycle": "experimental"
    },
    {
      "repository_path": "game-ui/screen-recipes.md",
      "domain": "game-ui",
      "lifecycle": "experimental"
    },
    {
      "repository_path": "game-ui/unity/animation/animation-2d.md",
      "domain": "game-ui",
      "lifecycle": "experimental"
    },
    {
      "repository_path": "game-ui/unity/animation/animation-3d.md",
      "domain": "game-ui",
      "lifecycle": "experimental"
    },
    {